[
  {
    "contract_id": "product.vision",
    "sources": [
      "docs/product/vision.md"
    ],
    "ownership": "human-maintained",
    "authority": "canonical-documentation",
    "answered_questions": [
      "What problem does the product solve?"
    ],
    "requirement_map": {
      "problem and users": "REQ-VISION-PROBLEM",
      "product outcome": "REQ-VISION-OUTCOME",
      "success boundaries": "REQ-VISION-BOUNDARIES"
    },
    "claims": [
      {
        "id": "CLAIM-PRUMO-VISION-PROBLEM",
        "statement": "`docs/product/vision.md` states the problem Prumo addresses and who it is for.",
        "status": "accepted",
        "authority": "canonical-documentation",
        "revision": 1,
        "requires": [
          "REQ-VISION-PROBLEM"
        ],
        "evidence": [
          {
            "id": "EV-PRUMO-VISION-PROBLEM-DOC",
            "type": "canonical-document",
            "target": "CLAIM-PRUMO-VISION-PROBLEM",
            "revision": "1",
            "producer": "human-maintained",
            "verified": true,
            "artifact": "docs/product/vision.md"
          }
        ]
      },
      {
        "id": "CLAIM-PRUMO-VISION-OUTCOME",
        "statement": "`docs/product/vision.md` states the intended product outcome.",
        "status": "accepted",
        "authority": "canonical-documentation",
        "revision": 1,
        "requires": [
          "REQ-VISION-OUTCOME"
        ],
        "evidence": [
          {
            "id": "EV-PRUMO-VISION-OUTCOME-DOC",
            "type": "canonical-document",
            "target": "CLAIM-PRUMO-VISION-OUTCOME",
            "revision": "1",
            "producer": "human-maintained",
            "verified": true,
            "artifact": "docs/product/vision.md"
          }
        ]
      },
      {
        "id": "CLAIM-PRUMO-VISION-BOUNDARIES",
        "statement": "`docs/product/vision.md` and `docs/product/scope-v0.4.md` state the success and non-goal boundaries.",
        "status": "accepted",
        "authority": "canonical-documentation",
        "revision": 1,
        "requires": [
          "REQ-VISION-BOUNDARIES"
        ],
        "evidence": [
          {
            "id": "EV-PRUMO-VISION-BOUNDARIES-DOC",
            "type": "canonical-document",
            "target": "CLAIM-PRUMO-VISION-BOUNDARIES",
            "revision": "1",
            "producer": "human-maintained",
            "verified": true,
            "artifact": "docs/product/vision.md"
          },
          {
            "id": "EV-PRUMO-VISION-BOUNDARIES-SCOPE",
            "type": "canonical-document",
            "target": "CLAIM-PRUMO-VISION-BOUNDARIES",
            "revision": "1",
            "producer": "human-maintained",
            "verified": true,
            "artifact": "docs/product/scope-v0.4.md"
          }
        ]
      }
    ]
  },
  {
    "contract_id": "project.scope",
    "sources": [
      "docs/product/scope-v0.4.md"
    ],
    "ownership": "human-maintained",
    "authority": "canonical-documentation",
    "answered_questions": [
      "What is explicitly out of scope?"
    ],
    "requirement_map": {
      "in-scope capabilities": "REQ-SCOPE-IN",
      "non-goals": "REQ-SCOPE-NONGOALS",
      "compatibility constraints": "REQ-SCOPE-COMPAT"
    },
    "claims": [
      {
        "id": "CLAIM-PRUMO-SCOPE-IN",
        "statement": "`docs/product/scope-v0.4.md` lists the in-scope capabilities of the current delivery.",
        "status": "accepted",
        "authority": "canonical-documentation",
        "revision": 1,
        "requires": [
          "REQ-SCOPE-IN"
        ],
        "evidence": [
          {
            "id": "EV-PRUMO-SCOPE-IN-DOC",
            "type": "canonical-document",
            "target": "CLAIM-PRUMO-SCOPE-IN",
            "revision": "1",
            "producer": "human-maintained",
            "verified": true,
            "artifact": "docs/product/scope-v0.4.md"
          }
        ]
      },
      {
        "id": "CLAIM-PRUMO-SCOPE-NONGOALS",
        "statement": "`docs/product/scope-v0.4.md` lists the explicit non-goals.",
        "status": "accepted",
        "authority": "canonical-documentation",
        "revision": 1,
        "requires": [
          "REQ-SCOPE-NONGOALS"
        ],
        "evidence": [
          {
            "id": "EV-PRUMO-SCOPE-NONGOALS-DOC",
            "type": "canonical-document",
            "target": "CLAIM-PRUMO-SCOPE-NONGOALS",
            "revision": "1",
            "producer": "human-maintained",
            "verified": true,
            "artifact": "docs/product/scope-v0.4.md"
          }
        ]
      },
      {
        "id": "CLAIM-PRUMO-SCOPE-COMPAT",
        "statement": "`docs/product/scope-v0.4.md` states the compatibility constraints and the migration boundary.",
        "status": "accepted",
        "authority": "canonical-documentation",
        "revision": 1,
        "requires": [
          "REQ-SCOPE-COMPAT"
        ],
        "evidence": [
          {
            "id": "EV-PRUMO-SCOPE-COMPAT-DOC",
            "type": "canonical-document",
            "target": "CLAIM-PRUMO-SCOPE-COMPAT",
            "revision": "1",
            "producer": "human-maintained",
            "verified": true,
            "artifact": "docs/product/scope-v0.4.md"
          },
          {
            "id": "EV-PRUMO-SCOPE-COMPAT-DEPTEST",
            "type": "conformance-test",
            "target": "CLAIM-PRUMO-SCOPE-COMPAT",
            "revision": "1",
            "producer": "prumo-maintained",
            "verified": true,
            "artifact": "conformance/schema-runtime/conformance_test.go"
          }
        ]
      }
    ]
  },
  {
    "contract_id": "architecture.system",
    "sources": [
      "docs/architecture/overview.md",
      "docs/architecture/dependency-rules.md"
    ],
    "ownership": "human-maintained",
    "authority": "canonical-documentation",
    "answered_questions": [
      "What owns canonical state?",
      "Which components may mutate it?"
    ],
    "requirement_map": {
      "system boundaries": "REQ-ARCH-BOUNDARIES",
      "major components": "REQ-ARCH-COMPONENTS",
      "dependency direction": "REQ-ARCH-DIRECTION",
      "external integrations": "REQ-ARCH-INTEGRATIONS"
    },
    "claims": [
      {
        "id": "CLAIM-PRUMO-ARCH-BOUNDARIES",
        "statement": "`docs/architecture/overview.md` states the system boundaries of the harness, documentation control plane and CLI.",
        "status": "accepted",
        "authority": "canonical-documentation",
        "revision": 1,
        "requires": [
          "REQ-ARCH-BOUNDARIES"
        ],
        "evidence": [
          {
            "id": "EV-PRUMO-ARCH-BOUNDARIES-DOC",
            "type": "canonical-document",
            "target": "CLAIM-PRUMO-ARCH-BOUNDARIES",
            "revision": "1",
            "producer": "human-maintained",
            "verified": true,
            "artifact": "docs/architecture/overview.md"
          }
        ]
      },
      {
        "id": "CLAIM-PRUMO-ARCH-COMPONENTS",
        "statement": "`docs/architecture/overview.md` and `docs/architecture/documentation-control-plane.md` name the major components.",
        "status": "accepted",
        "authority": "canonical-documentation",
        "revision": 1,
        "requires": [
          "REQ-ARCH-COMPONENTS"
        ],
        "evidence": [
          {
            "id": "EV-PRUMO-ARCH-COMPONENTS-DOC",
            "type": "canonical-document",
            "target": "CLAIM-PRUMO-ARCH-COMPONENTS",
            "revision": "1",
            "producer": "human-maintained",
            "verified": true,
            "artifact": "docs/architecture/overview.md"
          },
          {
            "id": "EV-PRUMO-ARCH-COMPONENTS-CP",
            "type": "canonical-document",
            "target": "CLAIM-PRUMO-ARCH-COMPONENTS",
            "revision": "1",
            "producer": "human-maintained",
            "verified": true,
            "artifact": "docs/architecture/documentation-control-plane.md"
          }
        ]
      },
      {
        "id": "CLAIM-PRUMO-ARCH-DIRECTION",
        "statement": "`docs/architecture/dependency-rules.md` states the dependency direction and the layer import policy.",
        "status": "accepted",
        "authority": "canonical-documentation",
        "revision": 1,
        "requires": [
          "REQ-ARCH-DIRECTION"
        ],
        "evidence": [
          {
            "id": "EV-PRUMO-ARCH-DIRECTION-DOC",
            "type": "canonical-document",
            "target": "CLAIM-PRUMO-ARCH-DIRECTION",
            "revision": "1",
            "producer": "human-maintained",
            "verified": true,
            "artifact": "docs/architecture/dependency-rules.md"
          },
          {
            "id": "EV-PRUMO-ARCH-DIRECTION-ROUNDTRIP",
            "type": "conformance-test",
            "target": "CLAIM-PRUMO-ARCH-DIRECTION",
            "revision": "1",
            "producer": "prumo-maintained",
            "verified": true,
            "artifact": "conformance/schema-runtime/roundtrip_test.go"
          }
        ]
      },
      {
        "id": "CLAIM-PRUMO-ARCH-INTEGRATIONS",
        "statement": "`docs/architecture/overview.md` and `docs/integration/connector-contract.md` describe the external integration surface.",
        "status": "accepted",
        "authority": "canonical-documentation",
        "revision": 1,
        "requires": [
          "REQ-ARCH-INTEGRATIONS"
        ],
        "evidence": [
          {
            "id": "EV-PRUMO-ARCH-INTEGRATIONS-DOC",
            "type": "canonical-document",
            "target": "CLAIM-PRUMO-ARCH-INTEGRATIONS",
            "revision": "1",
            "producer": "human-maintained",
            "verified": true,
            "artifact": "docs/integration/connector-contract.md"
          }
        ]
      }
    ]
  },
  {
    "contract_id": "testing.strategy",
    "sources": [